{
  "schema_version": 1,
  "kind": "toy",
  "id": "phytoy.toy.fixed_focus_alpha",
  "version": "0.1.0",
  "capture_medium_family": "digital_sensor_v1",
  "optics": {
    "distortion": [0.025, -0.008, 0.0, 0.0],
    "ca_scale": [1.003, 1.0, 0.997],
    "vignette": [0.28, 0.08],
    "psf": {
      "bases": [
        [
          [0.0, 0.0, 0.0, 0.0, 0.0],
          [0.0, 0.0, 0.0, 0.0, 0.0],
          [0.0, 0.0, 1.0, 0.0, 0.0],
          [0.0, 0.0, 0.0, 0.0, 0.0],
          [0.0, 0.0, 0.0, 0.0, 0.0]
        ],
        [
          [0.0030, 0.0133, 0.0219, 0.0133, 0.0030],
          [0.0133, 0.0596, 0.0983, 0.0596, 0.0133],
          [0.0219, 0.0983, 0.1621, 0.0983, 0.0219],
          [0.0133, 0.0596, 0.0983, 0.0596, 0.0133],
          [0.0030, 0.0133, 0.0219, 0.0133, 0.0030]
        ]
      ],
      "coefficients": [
        [
          [[0.2, 0.4, 0.2], [0.4, 0.85, 0.4], [0.2, 0.4, 0.2]],
          [[0.25, 0.45, 0.25], [0.45, 0.9, 0.45], [0.25, 0.45, 0.25]],
          [[0.18, 0.38, 0.18], [0.38, 0.8, 0.38], [0.18, 0.38, 0.18]]
        ],
        [
          [[0.8, 0.6, 0.8], [0.6, 0.15, 0.6], [0.8, 0.6, 0.8]],
          [[0.75, 0.55, 0.75], [0.55, 0.1, 0.55], [0.75, 0.55, 0.75]],
          [[0.82, 0.62, 0.82], [0.62, 0.2, 0.62], [0.82, 0.62, 0.82]]
        ]
      ]
    }
  },
  "sensor": {
    "cfa": "RGGB",
    "scene_to_sensor": [
      [1.0, 0.0, 0.0],
      [0.0, 1.0, 0.0],
      [0.0, 0.0, 1.0]
    ],
    "exposure_scale_e": 720.0,
    "full_well_e": 900.0,
    "conversion_gain_e_per_dn": 1.0,
    "black_level_dn": 64.0,
    "white_level_dn": 1023.0,
    "adc_bits": 10,
    "read_noise_e": 2.4,
    "row_noise_e": 0.7,
    "column_noise_e": 0.45,
    "prnu_sigma": 0.012,
    "dsnu_e": 0.5,
    "profile_seed": 17991
  },
  "isp": {
    "white_balance": [1.08, 1.0, 0.94],
    "sensor_to_rec2020": [
      [1.04, -0.03, -0.01],
      [-0.02, 1.03, -0.01],
      [-0.01, -0.04, 1.05]
    ],
    "tone_curve": [
      [0.0, 0.0],
      [0.02, 0.025],
      [0.18, 0.23],
      [0.5, 0.62],
      [0.85, 0.9],
      [1.0, 1.0],
      [1.5, 1.0]
    ],
    "denoise_sigma": 0.35,
    "sharpen_amount": 0.18,
    "sharpen_radius": 0.9
  }
}

